{
  "version": 1,
  "generated": "2026-08-25T21:53:26Z",
  "folders": [
    {
      "path": "dnd-5e",
      "name": "Dungeons & Dragons 5e"
    },
    {
      "path": "draw-steel",
      "name": "Draw Steel"
    },
    {
      "path": "generic",
      "name": "Generic"
    }
  ],
  "templates": [
    {
      "id": "5e-magic-item",
      "name": "Magic Item",
      "version": "1.0.0",
      "folder": "dnd-5e",
      "path": "templates/dnd-5e/5e-magic-item/5e-magic-item.yml",
      "body_path": "templates/dnd-5e/5e-magic-item/5e-magic-item.md",
      "sha256": "20fca69523b1c464343e4e10afaae3f44664b1278ad77a506ab1c0f3be06f6be",
      "body_sha256": "5a00ccd5be2effe4b36c21af0809d279042a5daa3a1afdc2481661ae8798a7f9",
      "system": "D&D 5e",
      "category": "Items",
      "description": "A magic item with rarity, attunement, properties, and charges.",
      "author": "hunter-read",
      "grimoire_min_version": "1.5.6"
    },
    {
      "id": "5e-npc",
      "name": "NPC",
      "version": "1.0.0",
      "folder": "dnd-5e",
      "path": "templates/dnd-5e/5e-npc/5e-npc.yml",
      "body_path": "templates/dnd-5e/5e-npc/5e-npc.md",
      "sha256": "6bab91e0c566b8d45f9644bc141d865366039c6fbc1f00aa9f58a289c906e7b7",
      "body_sha256": "a78f81a8c4229cc77c400c733b3355b97b5c6c038d761aa1be054141a38ee23c",
      "system": "D&D 5e",
      "category": "Characters",
      "description": "A non-player character with statblock, motivation, and plot hooks.",
      "author": "hunter-read",
      "grimoire_min_version": "1.5.6"
    },
    {
      "id": "5e-spell",
      "name": "Spell",
      "version": "1.0.0",
      "folder": "dnd-5e",
      "path": "templates/dnd-5e/5e-spell/5e-spell.yml",
      "body_path": "templates/dnd-5e/5e-spell/5e-spell.md",
      "sha256": "48e1abc0343b0aa4b8a365c11f1cc26aebb856af82daf92cf7bb2e1e7f9ac614",
      "body_sha256": "fab5d363fce1b9882810fabf3a4f7ef7babea0d4481f8956ef40e4c6520fc645",
      "system": "D&D 5e",
      "category": "Spells",
      "description": "A 5e spell with level, school, casting time, range, components, duration, and effect.",
      "author": "hunter-read",
      "grimoire_min_version": "1.5.6"
    },
    {
      "id": "ds-encounter",
      "name": "Encounter",
      "version": "1.0.0",
      "folder": "draw-steel",
      "path": "templates/draw-steel/ds-encounter/ds-encounter.yml",
      "body_path": "templates/draw-steel/ds-encounter/ds-encounter.md",
      "sha256": "65e903ddd6293e71c4d60f98f1fe4a281f24bd62430f09fffe69b449067a2715",
      "body_sha256": "6168a1c50837bd20919df85692d68878bf997ed3a53947a2f1a1dbd3ca961f6d",
      "system": "Draw Steel",
      "category": "Encounters",
      "description": "A Draw Steel combat encounter with victories, terrain, enemy roster, and objectives.",
      "author": "hunter-read",
      "grimoire_min_version": "1.5.6"
    },
    {
      "id": "ds-montage-test",
      "name": "Montage Test",
      "version": "1.0.0",
      "folder": "draw-steel",
      "path": "templates/draw-steel/ds-montage-test/ds-montage-test.yml",
      "body_path": "templates/draw-steel/ds-montage-test/ds-montage-test.md",
      "sha256": "0002269e53065478338055f9865acdcab4feadf7869108dcae4bf95d2f543268",
      "body_sha256": "beb5312c0538dc7abcf91a4a2993dbf69969e15b07de40e7957c0d4cf3a54705",
      "system": "Draw Steel",
      "category": "Encounters",
      "description": "A Draw Steel montage test with objective, challenges, and success/failure outcomes.",
      "author": "hunter-read",
      "grimoire_min_version": "1.5.6"
    },
    {
      "id": "ds-negotiation",
      "name": "Negotiation",
      "version": "1.0.0",
      "folder": "draw-steel",
      "path": "templates/draw-steel/ds-negotiation/ds-negotiation.yml",
      "body_path": "templates/draw-steel/ds-negotiation/ds-negotiation.md",
      "sha256": "2e531ad7c3c45b2d5f974d70863d8832569e271a48aad97f091e9b959e6c73cc",
      "body_sha256": "2cdf167a0b9e7934fd8e8db9f36bd99b5510f9bb90f99d63720c57bc723eac89",
      "system": "Draw Steel",
      "category": "Encounters",
      "description": "A Draw Steel negotiation with interest, patience, motivations, and pitfalls.",
      "author": "hunter-read",
      "grimoire_min_version": "1.5.6"
    },
    {
      "id": "faction",
      "name": "Faction",
      "version": "1.0.0",
      "folder": "generic",
      "path": "templates/generic/faction/faction.yml",
      "body_path": "templates/generic/faction/faction.md",
      "sha256": "9530d881f06448b712ce7d3175b2f9714ccbe94ce6031dc3bd362bcc4435b8f6",
      "body_sha256": "856c8b30039ef44440beabc0298e9720f63eb9e32de5a5ede01f01d7bd4c9798",
      "category": "Factions",
      "description": "An organisation with goals, assets, and relationships.",
      "author": "hunter-read",
      "grimoire_min_version": "1.5.6"
    },
    {
      "id": "location",
      "name": "Location",
      "version": "1.0.0",
      "folder": "generic",
      "path": "templates/generic/location/location.yml",
      "body_path": "templates/generic/location/location.md",
      "sha256": "a10fae4593f73d63e89309c09080f129ff957107265bc9d7a3b2ef558b210936",
      "body_sha256": "243e47f1ca5416e7d270fd4a59268a523437a5284d1fe21d78eb7f244e8737d1",
      "category": "Locations",
      "description": "A place the party can visit, with sights, people, and hooks.",
      "author": "hunter-read",
      "grimoire_min_version": "1.5.6"
    },
    {
      "id": "quest-hook",
      "name": "Quest Hook",
      "version": "1.0.0",
      "folder": "generic",
      "path": "templates/generic/quest-hook/quest-hook.yml",
      "body_path": "templates/generic/quest-hook/quest-hook.md",
      "sha256": "0f9350e8db076d817b3816a9ac2bdadfb76ac8dbf13307ed434f521bf1b24707",
      "body_sha256": "45141cb5b730e957870a328f2b9356f97cf02e17f16af26349e464aa354da052",
      "category": "Quests",
      "description": "An adventure hook with the pitch, stakes, and rewards.",
      "author": "hunter-read",
      "grimoire_min_version": "1.5.6"
    },
    {
      "id": "session-recap",
      "name": "Session Recap",
      "version": "1.0.0",
      "folder": "generic",
      "path": "templates/generic/session-recap/session-recap.yml",
      "body_path": "templates/generic/session-recap/session-recap.md",
      "sha256": "1a24e937df3455b9b96f42c695321a7212679fe217820252de4754fa2e624f1f",
      "body_sha256": "3ee7204c8d8d26f8d7e47f2970533bf10cae4f7910e8305547197e2b9ab628c8",
      "category": "Sessions",
      "description": "A recap of what happened, who was there, and what comes next.",
      "author": "hunter-read",
      "grimoire_min_version": "1.5.6"
    }
  ]
}
